{
    "version": "1",
    
    "env": {
        "test-env": "1"
    },

    "options": {
        "interpolation": true
    },

    "targets": {
        "target1": {
            "stages": {
                "test": {
                    "module": "1",
                    "args": "aaa",
                    "before": {},
                    "after": {}
                },
                "test2": {
                    "module": "1",
                    "args": ["aaa"],
                    "before": {
                        "echo": "echo ${HOME}"
                    },
                    "after": {
                        "echo": "echo ${HOME}"
                    }
                },
                "test3": {
                    "module": "1",
                    "args": {"--test": "aaa"}
                }
            },
            "env": {},
            "before": {},
            "after": {},
            "options": {
                "allow_failure_stage": ["test"],
                "allow_failure_before": [],
                "allow_failure_after": []
            }
        },
        "target2": {
            "stages": {
                "test": "target1.test"
            }
        }
    }
}